<xs:schema xmlns:xs="http://www.w3.org/2001/XMLSchema">
  <xs:element name="empleados">
    <xs:complexType>
      <xs:sequence>
        <xs:element name="empleado" maxOccurs="unbounded">
          <xs:complexType>
            <xs:sequence>
              <xs:element name="nombre" type="xs:string"/>
              <xs:element name="apellidos" type="xs:string"/>
              <xs:element name="fechaNacimiento" type="xs:date"/>
              <xs:element name="puesto">
                <xs:complexType>
                  <xs:sequence>
                    <xs:element name="titulo" type="xs:string"/>
                    <xs:element name="departamento" type="xs:string"/>
                  </xs:sequence>
                </xs:complexType>
              </xs:element>
              <xs:element name="direccion" type="xs:string" minOccurs="0"/>
            </xs:sequence>
            <xs:attribute name="id" type="xs:ID"/>
          </xs:complexType>
        </xs:element>
      </xs:sequence>
    </xs:complexType>
  </xs:element>
</xs:schema>
